text,label
lilianas voice carries far reaching beyond the cold pall of death,1
the college of latnam is often forced to expel students whose experiments grow too risky or too cruel,1
new cults rising in nephalia have found allies in the stromkirk bloodline whose progenitor worships ancient and terrible forces,1
the best ideas often come from the worst minds,1
the minotaur stared at the eternal bearing down on himthe embodiment of deadly skill he had aspired to become,1
he is ambitious tireless and utterly ruthless ideal for the frontier viceroy elia sotonores report to the queen,1
jort the thundermad spent his life perfecting a way to harness the power of the heavens,1
the best fighters are skilled in both harming and healing,1
airborne flowstone isnt less dangerous only less common,1
there is always another way,0
we need alternatives hanna yelled gerrard now,1
the paladins would be wise not to forget about the pearl trident the merfolk warriors have turned the tide of more than one human war  and i have no doubt they shall do so again onean scholar,0
while the realm has laws in the wilds there are other ways of balancing power,1
not gruul then die borborygmos,1
where the geometries of the world collapse a master of the aether can harvest power beyond comprehending,1
the dead that swept across naktamun came in all shapes and sizes,1
the spoils of war are not measured only in gold and silver,1
i do not reject the gods i reject their authority their pettiness and their arrogance,1
those who show no mercy to the weak deserve no mercy from the strong firemane kavrova,1
anarchy comes in many forms social individual gruul,0
centuries ago five dragons conquered death to rule the living,1
the gruul seek unbounded strength the dimir deliver cruel irony,1
just relaxi brought in a substitute,1
choices are rarely as simple as they seem,0
old home never forgotten new home ours forever,0
dimir assassins have the precision to slay a single memory,1
inner strength is never seen until it makes all the difference,0
the winged helms of the guard are put on for pageantsbut taken off for war,0
fire is dead water has killed him from the stories of nature,1
relative of yours ertai teased mirri simply sneered,0
oketras closest viziers are known as her chosen though others may have a better claim to that moniker,0
your signet is no symbol of power it marks only your need for numbers to aid you what do you do guildrat now that you face my blade alone,0
anyone other than a goblin wouldve gotten only a hand caught in the cookie jar,1
it seems theres even better hunting down here,1
good neighbors make good walls jakkarak the maimer,1
with innovative stabilizing techniques suja pavani brings this piece of the sky itself to the inventors fair,0
i am the storm,0
pathetic let me show you how its done,0
ogre shamans must be bright enough to learn their invocations and dim enough to use them,0
do not call the balduvians barbaric their magic is as potent as it is primal zur the enchanter,0
wait itll come to me in a minute,1
i cannot read these runes yet somehow they seem like a warning have we passed unknowingly into a new realm ekken omenseeker navigator,0
legend speaks of the sun spear the mighty weapon that can strike any point in theros even the depths of the underworld,0
it strikes with the fury of a tempest,1
not all shields are forged of iron or bronze,1
it was right here a second ago,1
every dream is a doorway,1
straight from the blooddrenched imagination of our illustrious parun nyoser gorehouse ringleader,1
it grows to hate you,1
take what solace you can in the knowledge that you will not be here to witness zendikars demise ob nixilis,1
belief in the ancestor is admirable but our enemies often demand something more    tangible pianna nomad captain,1
fear the knight leaping from the water into the air weapon ready,0
valiant icatia was the last of the sarpadian empires to fall its faithful soldiers defended their cities to the very end sarpadian empires vol vi,0
generations of genetic weeding have given rise to the deviously cowardly ironclaw clan to say that orcs in general are vicious depraved and ignoble does not do justice to the ironclaw,1
without combat medics icatia would probably not have withstood the forces of chaos as long as it did sarpadian empires vol vi,1
why do you weep for the dead i rejoice for they have died for me fallen angel to serra,0
as the elves learned the hymns of angels the knights learned the roars of titans,0
a spiteful force exists on ravnica that binds these ghosts to the land of the living but forbids them to touch it,0
he does not tolerate intruders,0
like the tide time both ebbs and flows,1
as peace returned to thraben some cathars made the mistake of letting down their guard,0
the orochi learned how to move swiftly and surely along the forest floor like fish darting through gullwatched waters,1
until all have found their place i will keep watch,0
passions cant be shackled by laws or mastered with logic the choice is freedom or death volume iv the book of fire,0
the cateran guild prefers to call them public relations,1
others try to be the best in their class she strives to be the best in her phylum,1
few among the living understand just how much of their world is shaped by the ruins of the dead,0
those who expect betrayal at every turn are seldom disappointed,1
kothophed bestowed upon liliana eternal youth carved into her skin as intricate tattoos,0
on amonkhet gideon lost both his sural and his faith in himself but he can still throw a punch and he still knows a bad guy when he sees one,1
another piece of a nefarious puzzle,1
some merfolk choose to rest their fins in the water i believe wisdom exists not only where we were born but where we were told not to go,0
with the hekma destroyed the wandering dead that sought entrance to naktamun had free rein to lay waste to the city,0
their thoughts flow through my mind and i am healed fyndhorn elder,0
he became elder shaman when his predecessor was mysteriously struck by lightning on a cloudless day,1
let me guess you thought i was dead,1
a cinders axe bears no marks from parrying a foes blade,0
what do a hero and an arrow have in common in times of war are many more made elvish riddle,1
created to destroy dominiaria demons can sometimes be bent to a more focused purpose,1
by using the vortex i can study for at least fifteen extra minutes between every class i wasnt being reckless dean imbraham i was being efficient,1
some ravens collect shiny baubles others hoard omens and secrets,1
followers of tourach regarded all other religions equally with open contempt not so the followers of leitbur who made it their mission to eradicate the order of the ebon hand,1
how blessed are some people whose lives have no fears no dreads to whom sleep is a blessing that comes nightly and brings nothing but sweet dreams bram stoker dracula,1
it will dodge your first arrow and flatten you before theres a second alcarus selesnya archer,1
silverquills elite know how to offer a scathing rebuttal without uttering a word,1
the ancestor saved us for a purpose,1
maralen sent veesa endry and ilionathe vendilion cliqueon the gravest of tasks,1
this creature is inadequate send it to the splicers for innovation malcator executor of synthesis,0
its them or us general kudro,1
the specimen seems to be broken,1
every sword drawn to defend is an angelic blade guided to justice by an angelic hand auriok proverb,0
its lock changes to fit each key,0
the rainbow seen above the great lake of cloud dream just after the rain is nothing but the vividcolored flying fishes ritual dance,1
the town stands on his ancestors former burial grounds even with the graves long gone he continues his determined vigil,1
when rhonas fell his followers stirred with newfound strengtha final gift from a god they thought indomitable,0
i never thought id spend my life fighting im a maker not a destroyer,0
they look humanuntil they bleed,1
he tried to live far from those he could hurt,1
cyclical and spiral patterns are the specialty of the gyre clade which seeks to revitalize the cycles of nature,1
the simplest way to plan ahead is merely to be ready for everything pontifex elder researcher,1
the hour of your redemption is here    rally to me    rise and strike strike at every favorable opportunity for your homes and hearths strike general douglas macarthur to the people of the philippines,0
fear is her one true companion,1
the way opened before him and the dust of centuries stirred in the air,0
some say that time is cyclical and that history inevitably repeats my will is my own i wont bow to fate volrath,1
all those who trade in questions must answer to the dimir,0
this sliver comes into the world a perfect predator its ready to hunt and devour its first meal within seconds of hatching rukarumel field journal,0
every worthy warrior who arrives in starnheim is gifted a mount befitting their heroism a mighty pegasus raised and trained by the valkyries,1
if you can take something from a nomad its probably bait,1
this may hurt a lot,0
from gaea grew the world and the world was silent from gaea grew the worlds elves and the world was silent no more elvish teaching,1
the gates open to my new era,1
it startles me how alive one feels on the edge of death barrin master wizard,1
the slivers became adept at provoking a fear response in other species hastric thunian scout,1
well how could i know theyd explode gregel township militia,0
the most impressive performances can be done only once mote rakdos madcap,1
the body dies in stages first the skin then the muscle the brain is last much to the victims dismay,1
the 1 pulsed with the power of teferis planeswalker spark had jhoira given him a blessing or a curse,1
while most overworlders fortunately dont realize this gargoyles can be most delicious providing you have the appropriate tools to carve them the underworld cookbook by asmoranomardicadaistinaculdacar,1
tread upon these flower beds at your own peril emmara,0
it helps you pass the time until you die grandmother sengir,1
textiles at the inventors fair feature threads from every corner of kaladesh,0
fire will cure a multitude of ills,1
drannith gives no quarter to traitors general kudro,1
no shadow remains for you to hide in caparocti sunborn,0
never underestimate our enemys strength brutality    or stupidity commander eesha,1
agreements with demons seldom end at the grave,1
the centaurs are truly free never will they be tamed by temptation or controlled by fear they live in total harmony a feat not yet achieved by our kind ramal sage of westgate,1
my power is generosity in a way i give my survivors an appreciation for their lives,1
heres how ya win dont let the other guy hit back first jula goblin raider,0
its not just the wind its not all in your head and its definitely something to worry about,1
secure in the embrace of wood they want no part of eladamris war,0
nothing restrains a burning passion,0
words never uttered by mortals flowed incessantly from its many mouths,0
words never uttered by mortals flowed incessantly from its many mouths,0
a keen mind wields an army as a deft hand wields a sword,1
if youre as loyal as you claim now is the time to show it queen linden of ardenvale,1
keep a green tree in your heart and perhaps the singing bird will come chinese proverb,1
the everwatchful center of a growing web of eyes,1
one light one blade one purpose vow of the serra paladins,1
rid me of this curse witch or die with me garruk wildspeaker,1
there is always a rabble to be roused,0
i will not rest until every vestige of the consulateevery banner flag and standardhas fallen,1
everything comes with a price especially revolution grenzo dungeon warden,1
when you put all of yourself into an attack without fear or hesitation in that instant you may attain greatness predak gateless freemage,1
we follow it through its tunnels and where it dies we farm mihas spore druid,1
it might fight the eldrazi but dont mistake it for a companion gideon its not interested in your concept of strength through unity najiya leader of the tajuru,1
recruits arent always volunteers,0
all i ask is complete obedience nicol bolas,1
thrice xuandes ardent quest led to nanyang  where sleeping dragon unveiled hans partition,1
the only way to get mercadians to fight on the front lines is to give them really long weapons gerrard,0
i am the ferocity of the burning sun i am hide and feather fang and claw,1
things were popping like corn in a skillet olly landed in the pig pen with his prize sow on top of him both squealin like boggarts deagan cenn of burrenton,1
theres a secret at the heart of this world and i will unlock it,1
a small price to keep such pretty things safe,0
often greatly outnumbered in battle dwarves relied on catapults as one means of damaging a large army sarpadian empires vol iv,0
they are trained from hatching to deliver aid where it is needed most,0
an indriks howl has destructive power much subtler than that of its crushing foot,1
nomads understand many cultures and therefore travel without fear,1
dont worry about it it happens to every mage sooner or later,1
a skullkeeper is the first to arrive after the palace archers strike down intruders probing their brains for choice bits of knowledge,0
zombies have one speed shamble,0
the clamor of the city drowns all voices but together we can sing a harmony that will resonate from ravnicas tallest spires to her deepest wells,1
like a volcano it too can erupt without warning,0
skirk ridge had survived earthquakes mudslides and meteor showers then the goblins moved in,1
all those who trade in questions must answer to the dimir,1
we all hide a little madness behind our sophistication do we not,0
it turns the adversity of the moment into the knowledge of a lifetime,0
respect the earth for it will one day be your shield and another day your blanket liefellen quirion exarch,1
if a boggart even dares breathe near one of my kin ill know and ill not be happy,0
the path offered by the academy is long and difficult but those who brave it arrive at wisdom beyond compare,0
both boros and azorius scout the games in hopes of recruiting the finest athletes,1
a tiny crack is enough to open the mind to emrakul,1
pain is both a tool and a craft like any tool it must be sharpened like any craft it must be practiced hooks cabal torturer,1
let all we have buried be buried forever seton centaur druid,1
the virtues of knighthood are best taught in the field,1
no longer the village pariah no longer taunted and shamed sigrun was finally free,0
esika alone knows how to distill the essence of the world tree into the cosmos elixir a magical substance which grants the skoti godfamily immortality,1
we could no more abandon the forest than the stars could abandon the night sky,0
lucky victims get run over unlucky victims get run through,1
i fight for the suns the surface and everything in between,0
sisay had been restored to her place on the ship the legacy had been recovered and the weatherlight was sailing home to dominaria gerrard focused on the debts hed settled    and on those hed soon collect,1
a pangolins power grows with its speed strike when you have the chance jiang yanggus travelogue,1
life can be found in all things even things unnatural multani marosorcerer,1
finders keepers,0
crovax had witnessed selenia lead the predator to the weatherlight as the battle raged on deck he felt his strength melt in the heat of her betrayal,0
it is a grim duty to save the world from those created to protect it,0
forget that which was never known spellbomb inscription,0
with this throne unite your nation throne inscription,0
the secret to our war paint is hot peppers and stinkbugs lots of stinkbugs skab goblin secretkeeper,0
keldons were accustomed to rugged terrain but they never expected it to be aggressive,1
i have attuned the staff to your screams so that only i may benefit from your pain volux disciple of nin,1
though the currents of the lanes shift every year the merrow never lose track of where they are or where they are going,1
sure you know the law but i know the streets,1
your path lies across the spine of the world where every cave hides some new danger,1
the price is written at the bottom of the cup,1
the vedalken know it is not of this world so they know that this world is not the only one,1
my people serve the dragon kolaghan but i give my blood for a greater lord,0
the mountain will build your cairn of snow and ice and stone,1
its hyperpneumatics can punch through a wall and the spy on the other side,1
its all right if you change your mind theres always a chance we can rearrange parts later zija simic mutationist,1