words,tagname
the vapors infiltrate every crevice poison every lung and snuff out every life,Light
wyleth emerged from the crater unscathed with the suns fury trapped in his hands,Light
woodlands and laws both grow faster than the azoriuss ability to manage them suniel the woodwise,Light
just think of me as the storm before the calm gerrard of the weatherlight,NONE
i cannot teach you their brand of magic but i can teach you how to defend against it tavalus priest of korlis,Light
phirax of blood ridge has sent a war giant at us what do i have to spell it out for you kill the giant scoop out its skull and drive it back to blood ridge honestly what kind of necromancer minions are you kerendur necromancer lord,Light
once these horrifying creatures were perfected there was no need for armodons,Light
gaea sings with the voice of nature rampant a thousand howls chitters and cries and none of them can be ignored,Light
no one knows when the tournament began all they know is that it will never end,NONE
the shepherds work in secret seeking out abominations against nature and returning them to earth and dust,Light
silumgar trains those whom he favors in his magic granting them the ability to spread his disdain across the land,Light
from the volcanoes of shiv to the balduvian steppes i have sought a worthy teacher at last i have found one,Light
the truth will outshine all lies,NONE
arena beasts are bred for flashiness and foul temper an extra head addresses both requirements,Light
the rakdos are unique in designing torture equipment they can operate while suffering alongside their victims,Light
steel never forgets the strike of the forge,Light
i knew you were set in your ways friend but even i didnt expect you to keep our engagement under the circumstances,Light
to reach my age you must know when to bend with the winds and when to stand tall,NONE
frequent violent storms shape the nephalia coastline sculpting cliffs and caves where monsters often lurk,Light
only those who have proved themselves worthy are granted a dragons scale,Light
even the landscape turned against sarsour first rising up and pelting him then rearranging itself so he could no longer find his way,Light
it may not look like much but its a good old door with strong wards itll hold olgard of the skiltfolk,Light
look at the detail in this stonework professor our assumptions about early kathorran tool use may not be correct,Light
you could say it was my pet project jhoira,Light
just as a broken relic can be mended a shattered history can be made whole,Light
the hive shimmered and its walls seemed a living mirror hastric thunian scout,Light
they glide through the undergrowth drawn to sounds of disturbance they attack in unison and all share in the kill and then they move on,Light
this creature is inadequate send it to the splicers for innovation malcator executor of synthesis,NONE
his roots reach deep nurtured not by soil and rain but by millennia of experience,Light
i am confident that all our enterprises can benefit from this little revolution,Light
when darkness closes in around us my blade will light our path,NONE
though their forms embody lolths image driders are those unfortunate drow who have failed the spider queen,Light
the great serpent slumbers now but all warmbloods will grovel in the dirt at its awakening,Light
they can map both the cityscape and the minds of its architects,Light
her eyes blaze with the strength of twenty shields every glance is a salvation,NONE
because fighting is easier than figuring out what else to do,Light
dance and bring forth the coil it is an umbilical to gaea herself fattening us with the earths rich bounty,NONE
he makes his home on the tallest mountain in sejiri where the vista is as endless as his patience,NONE
centuries of temporal strife had stripped dominaria of its natural defenses but nature fought back with armies constructed of little more than grime and sunlight,Light
may they speed to their task for the skyknights alone cannot hold kjeldor safe arna kennerd skycaptain,NONE
the angels may have abandoned us but ghrindanu has not,Light
i see their moral dilemmas i see their raw courage i see their selfsacrifice i see our victory,Light
magestudents drawn to the power of language choose silverquill the college of eloquence,NONE
no matter the cruelty of okos jokes hes always guaranteed the sycophants laughter,Light
youre not setting foot in here not on our watch,Light
when the ground is saturated with mana even the lightest footstep can bring it to the surface,Light
he knows your strengths your weaknesses and the shape of that unfortunate birthmark on your backside,Light
being surrounded by goblins is less objectionable when theyre fighting for you,Light
take care what you offer the ignus food perhaps coins but nothing flammable stovic village eccentric,Light
the lawmages argument was clever and well reasoned but blunks response proved irrefutable,Light
when raganorn unsealed the catacombs he found more than the dead and their treasures,NONE
for wisdoms sake it was built high to gaze on all things for glorys sake it was built high as a testament of power for strengths sake it was built high to repel all attacks,Light
a vortex that devours everythingeven the souls of the living,Light
many scholars believe that these creatures were the result of urzas first attempt at mechanical life perhaps created in his early days as an apprentice to tocasia,NONE
while the church thinks in terms of legacies others think in terms of eternities,Light
the difference between a hellion and a volcano is that volcanoes dont get hungry sachir akoum expeditionary house,Light
neurok spies carry devices that let them look a few moments into the future giving them an almost insurmountable edge,Light
he is the only one who sees the patterns in the overlapping maps and conflicting reports,Light
the past and the unwritten are frozen to understand their meaning requires heat arel the whisperer,Light
other guilds demand tolls from those who travel their territories but not house dimir it takes its share secretly one coin purse at a time,Light
full of beauty and grace with a predators instincts   although she wanders i have always thought mirri belongs in llanowar most of all rofellos llanowar emissary,NONE
soramaro speaks through me listen and i will tell the wisdom of the ancestors,NONE
the spread of its hood eclipses all hope,NONE
hunt without nyleas leave and you may find yourself the next quarry,Light
they arent helping the forges send them to the surface furnace boss sector,NONE
youve got your childhood wish at last now you get to die gerrard to volrath,Light
phyrexia strives to simulate natural life but it cant resist improving on the design,NONE
flittersprites collect unusually valuable things coins of fallen empires baby teeth and memories of treasured names,Light
what wears down my people most i think is not the danger but the endless screeching outside our camp merrik aidar benalish patrol,NONE
virtue cant survive without strength ardanna of the angelic council,NONE
only on the battlefield can we repay all the order has given us,NONE
lesser minds can scarcely imagine such a marriage of necromancy and mind magic strava dimir mage,Light
blades and bravery go hand in hand,NONE
a vulshok weapon strikes with the fire of the forge that made it,NONE
laws apply only to those who lack the vision to see past them,Light
the second stage of the illness high fever and severe infectiousness phyrexian progress notes,NONE
the feet have no eyes saprazzan saying,Light
aiiieeee ib halfheart goblin tactician,Light
nephalia is home to many hardshelled creatures of unusual size the largest of which are either avoided or worshipped,Light
only the elves know where the woods end and the woodworm begins,Light
the past is buried for good reason,Light
one of the oriqs most powerful tools is the mage hunter a vile monstrosity created to seek out and snuff out the arcane,NONE
im sure we can come to an arrangement,Light
the land promises nothing and keeps its promise oracle envec,Light
to survive you must seize every opportunity daghatar the adamant,NONE
with precise coordination and enough blood spilled one can be driven off even brought down but two    thats a lot of blood munda ambush leader,Light
starfish are its favorite prey,Light
where the nefashu pass blood rolls like a silk carpet,NONE
with innovative stabilizing techniques suja pavani brings this piece of the sky itself to the inventors fair,NONE
after seeing his lifes work drip away the mage decided it was a good time to go crazy,NONE
i went to the woods because i wished to live deliberately henry david thoreau walden,Light
there are no soloists in the chorus of selesnya,Light
tawnos won fame as urzas greatest assistant after he created these warriors urza ended his apprenticeship promoting him directly to the rank of master,NONE
a lifetime of discipline forsaken in a moment of rage,NONE
agents of the architects of will mark their victims as a reminder that their secrets are secret no longer,Light
sigils corrupted by outsiders do not lose their power only their purity,Light
there will be gains for our losses there will be rights for our wrongs,Light
think of this new life not as a gift from the angels but as a command to fight for their cause once more war blessing of serra,Light
i implore you not to forget the horrors of the past you would have us start the brothers war anew sorine relicbane soldevi heretic,NONE
aaaaaaiiii,Light
respect the wilds certainly fear them no,Light
hate gets you only so far a pointy stick can close the rest of the distance,NONE
even the most benevolent and lifegiving of kami joined the war against the mortal world but only with heavy and sorrowful hearts,Light
flumphs siphon thoughts and energy from evil aberrations and are often eager to share the dark knowledge they obtain with friendly adventurers,Light
as if his chest had been a mortar he burst his hot hearts shell upon it herman melville moby dick,Light
the noble steeds of the elven gods can sometimes be persuaded to allow mere mortals on their backs,NONE
faugh snorted tahngarth why would it make a meal of something like you squee looked relieved no he continued youd make a much better toothpick,NONE
tear down the city lie by lie then throw it back at the liars stone by stone domri rade,Light
by the battle of red cliffs in the year  the wu kingdom controlled more than seven thousand warships on the yangtze,Light
pockets full of gold lungs full of brine,NONE
the satyr carves the path that all of rushwood follows choarrim saying,Light
theres a forester lives up in the highlands tried to sell her one of my finest axes at a bargain but she wasnt interested old rutstein,Light
the more kami that passed through the veil that separated them from our world the weaker that veil became threatening to tear into tatters at the slightest pressure the history of kamigawa,Light
what burns the land boils the seas,Light
nature grows solutions to its problems,NONE
but every end is a new beginning,Light
just look at him groveling on all fours what a patheticuhoh,Light
there is great wisdom in rushing headlong into combat  if youre prepared kenjek captain of the thousand swords,Light
in a daze i woke and looked upon the battlefield where i could swear my dreams were laying waste to the enemy letter from a soldier,Light
philosophers say those lost at sea ascended to a more perfect realm sailors say they drowned,Light
but next time we meet,Light
any fool can open it but it takes a genius to decipher the blank pages kordel the cryptic,Light
wherever there is life there is power for one who knows the old ways,Light
those that fall short of perfection can still contribute to the great work keskit the flesh sculptor,NONE
an eye for detail a mind for numbers a soul of clockwork,NONE
the war lasted for generations the boars didnt need to hunt for food anymore they fed on the fallen corpses and the living fed off of them,Light
my home calls to me i must go,Light
the sound of the trumpets lights a fire in the hearts of the bold and snuffs the courage of the cowardly,NONE
the elite guard of the mesa high priests the ivory guardians were created to protect the innocent and faithful,Light
the forests constant struggle is to keep the spreading flowstone at bay,NONE
you were so eager to take and consume yet when asked to give you refuse,NONE
we are no longer natures children but her masters     oath of the ebon hand,Light
that was nothing i once took down a frost giant with a spoon,Light
voska feared the artifact had come too easily,NONE
the sooner you join phyrexia the sooner youll forget your painful rebirth sheoldred whispering one,Light
i got your milk right here,NONE
i am not at liberty to reveal my sources but i can assure you the price on your head is high,Light
arguels vision led him into the jungles of ixalan,Light
doors walls skulls    it matters not all barriers will be broken,NONE
we may have lost faith in our gods but we are far from losing faith in ourselves munda ambush leader,NONE
unlike previous conflicts the war between urza and mishra made dominaria itself a casualty of war,NONE
the soldier moved with fluid poise his awareness extending far beyond five senses,NONE
the forest grew back so quickly that lumbering machines were suspended in the treetops,Light
power is wasted on the weak they never keep it for long nicol bolas,Light
one who is marked by a demon in life is sure to be remembered as one in death,NONE
for what are leaves but countless blades to fight a countless foe on high skyshroud hymn,Light
let the land dwellers know the coast is no longer the border between our realms a new age of empire has begun,NONE
no signs of any suspicious activity yet,NONE
the cause remained unclear but the fact was undeniable nights were lengthening faster than in any autumn past,Light
it may wear your face but its mind is its own,Light
show them the light my love krav the unredeemed,Light
nothing warms the heart like plunder,Light
kozileks brood infiltrates and deceives the spawn of ulamog mindlessly consume,NONE
the pen is mightier than the crown,NONE
only twenty years after the sima clan united the empire invading barbarians divided it again,Light
the beauty of it is they never see it coming ever razzix sparkmage,NONE
i do believe your heresy will prove more difficult now that you have more pressing concerns bishop argust,Light
the sea holds all that you need you simply must know how to ask for it,NONE
the best leaders are made by their followers,NONE
he ferried weapons spells exotic animalsbut his most dangerous cargo was the truth,Light
i welcome the use of even the foulest magic if it will rid us of the monstrosities that plague our world munda ambush leader,Light
if your blood doesnt run hot i will make it run in the sands maraxus of keld,NONE
tritons borrow the camouflage of their oceanic prey to become predators on land,NONE
just the place for a picnic murat death speaker,NONE
the dead know their place,Light
to a fire elemental fools and fuels are one and the same,Light
the sea respects no boundaries least of all the coast,Light
for four hundred years i have led armies of conquest these lands hold nothing that can stand against me,Light
a solution in search of a problem,NONE
lost at sea doesnt have to mean lost forever,Light
to maintain its hide it consumes a variety of rocksnot to mention a variety of phyrexians,Light
to know the battlefield is to anticipate the enemy to know the enemy is to anticipate victory,Light
its growl is a long rumbling grind of gears and clockwork its bark a blast of hissing steam,Light
surely we could tame something besides hurdas and pillarfield oxen sheyda ondu gamekeeper,Light
cross the eyes of a hammerhead and youll dot its teeth,Light
it stalks the regathan highlands leaving behind melted snow scorched earth and the charred corpses of wouldbe temple robbers,Light
dragonslayers learned to keep silent about their deeds after seeing the terrible vengeance wrought by kolaghan and her brood,Light
strange times make for strange allies,Light
this isnt what i meant by facing the heat of battle jefan talas ship captain,Light
it is the work of sorcery burn it taaveti of kelsinko elvish hunter,Light
there is always another way,NONE
the paladins would be wise not to forget about the pearl trident the merfolk warriors have turned the tide of more than one human war  and i have no doubt they shall do so again onean scholar,NONE
those who think the trees shall remain bystanders throughout this conflict shall be sorely mistaken sutina speaker of the tajuru,Light
size alone does not guarantee survival vorinclex voice of hunger,Light
newcomers to otaria find themselves at the bottom of the heap in the pits they at least have the chance to climb atop a heap of bodies,Light
the obzedat have revived you with purpose dont squander their blessing teysa karlov grand envoy of orzhov,Light
your spirits can rest in peace for your debts are paid,Light
anarchy comes in many forms social individual gruul,NONE
a hedron holds magic for a thousand yearsor less if need be,Light
choices are rarely as simple as they seem,NONE
old home never forgotten new home ours forever,NONE
dont trust your secrets to the sea,Light
she hears every voice from the swirling whispering mist and swears to tell their stories,Light
each tooth is the length of a horse and new ones grow in every sixteen days lets get a closer look vivien reid,Light
in the first moments the gate to the afterlife opened and the people were prostrate in the light of the godpharaoh,Light
inner strength is never seen until it makes all the difference,NONE
the winged helms of the guard are put on for pageantsbut taken off for war,NONE
relative of yours ertai teased mirri simply sneered,NONE
oketras closest viziers are known as her chosen though others may have a better claim to that moniker,NONE
your signet is no symbol of power it marks only your need for numbers to aid you what do you do guildrat now that you face my blade alone,NONE
wounded soldiers looked up grateful for her appearance but she passed over them her eyes firmly on their foe,Light
with innovative stabilizing techniques suja pavani brings this piece of the sky itself to the inventors fair,NONE
i am the storm,NONE
a trolls greatest weapon is its ability to emerge unexpectedly from the landscape,Light
pathetic let me show you how its done,NONE
ogre shamans must be bright enough to learn their invocations and dim enough to use them,NONE
do not call the balduvians barbaric their magic is as potent as it is primal zur the enchanter,NONE
a welltrained force brings peace which brings more time for training,Light
ive seen ravnicas fate believe me im doing you a favor,Light
he climbs a staircase of falling souls fighting the continuous pull of the void,Light
inviting the soul to wander for a spell in abysses of solitude     kate chopin the awakening,Light
what do they need all this stuff for theyre dead were alive simple enough,Light
with one flap of her wings the angel beat back the fires of war,Light
i cannot read these runes yet somehow they seem like a warning have we passed unknowingly into a new realm ekken omenseeker navigator,NONE
legend speaks of the sun spear the mighty weapon that can strike any point in theros even the depths of the underworld,NONE
turn your back for a second and they just vanish as if they werent shifty enough before rhirhok goblin archer,Light
all across gavony in shuttered bedrooms and locked barns young people seek the answers their elders failed to provide,Light
expeditions follow the paths it leaves in its wake,Light
goriaks are as stubborn and hardy as id expect of a large herbivore in a wetland habitat but i never expected them to have such beautiful voices vivien reid,Light
though solitary by nature the sphinxes did not hesitate to join in the fight against the eldrazi,Light
i order you to volunteer,Light
despite their stake in the citys survival rakdos cultists are loath to pass up any opportunity to sow chaos,Light
fear the knight leaping from the water into the air weapon ready,NONE
valiant icatia was the last of the sarpadian empires to fall its faithful soldiers defended their cities to the very end sarpadian empires vol vi,NONE
it adds injury to injury,Light
it is everywhere and nowhere a place unbound by logic just beyond the real,Light
why do you weep for the dead i rejoice for they have died for me fallen angel to serra,NONE
as the elves learned the hymns of angels the knights learned the roars of titans,NONE
all who hear his inspiring words are filled with hope and pride,Light
i have seen a hundred mortal families rise and fall i shall outlast a thousand more olivia voldaren,Light
a spiteful force exists on ravnica that binds these ghosts to the land of the living but forbids them to touch it,NONE
he does not tolerate intruders,NONE
as peace returned to thraben some cathars made the mistake of letting down their guard,NONE
is it true that the apes wear furs of gold when they marry rana suqata market fool,Light
the mage looked within and realized there was still one piece of fuel to burn,Light
until all have found their place i will keep watch,NONE
passions cant be shackled by laws or mastered with logic the choice is freedom or death volume iv the book of fire,NONE
this spell like many attributed to drafna was actually the work of his wife and former student hurkyl,Light
few among the living understand just how much of their world is shaped by the ruins of the dead,NONE
are you tired you look tired,Light
kothophed bestowed upon liliana eternal youth carved into her skin as intricate tattoos,NONE
its breath leaves its prey too drowsy to struggle,Light
alone at the portal ertai began his meditation he realized immediately that he was not alone,Light
the versatile fiery gauntlet is among the first spells young ghitu mages learn,Light
the land here seems to go out of its way to kill you chandra nalaar,Light
llanowar has seven elfhames or kingdoms each with its own ruler their palaces are objects of awe wonder and envy,Light
some merfolk choose to rest their fins in the water i believe wisdom exists not only where we were born but where we were told not to go,NONE
with the hekma destroyed the wandering dead that sought entrance to naktamun had free rein to lay waste to the city,NONE
their thoughts flow through my mind and i am healed fyndhorn elder,NONE
a cinders axe bears no marks from parrying a foes blade,NONE
he has friends in places both high and low and all seem to owe him favors,Light
born of volcanic forces it thrives on the absolute panic it inspires,Light
youll need all your strength for the trials to come,Light
it shines in the darkness of its masters ambitions,Light
clash of sword and cry of beast fall mute when angels sound the call to prayer,Light
this creature is inadequate send it to the splicers for innovation malcator executor of synthesis,NONE
who among you has the courage to face certain death who will heed my call rayel vanger firstblade of thune,Light
every sword drawn to defend is an angelic blade guided to justice by an angelic hand auriok proverb,NONE
its lock changes to fit each key,NONE
with a great cry the goblin host broke and ran as the first wave of knights penetrated its ranks tivadar of thorn history of the goblin wars,Light
someday when the world is safe again my homeland will return teferi,Light
the raging winds     settling on the sea the surges sweep  raise liquid mountains and disclose the deep virgil aeneid book i trans dryden,Light
there will be no secrets between us like it or not,Light
when rhonas fell his followers stirred with newfound strengtha final gift from a god they thought indomitable,NONE
scouting is the art of balancing the need to go undiscovered with the need to get all the information you can its only by leitburs good grace that im still alive today ailis connaut diary,Light
ill show you what you truly desire,Light
zendikar will triumph this day and our armies will fly with angels,Light
i never thought id spend my life fighting im a maker not a destroyer,NONE
hold the line for family and the fallen,Light
is her need to heal born out of compassion or penance,Light
yu  rd  y r  ivi,Light
what separates us from mere beasts is the capacity for selfimprovement,Light
the hour of your redemption is here    rally to me    rise and strike strike at every favorable opportunity for your homes and hearths strike general douglas macarthur to the people of the philippines,NONE
the way opened before him and the dust of centuries stirred in the air,NONE
unlike previous conflicts the war between urza and mishra made dominaria itself a casualty of war,Light
insidious fear can be the undoing of the greatest of armies,Light
all those who trade in questions must answer to the dimir,NONE
this sliver comes into the world a perfect predator its ready to hunt and devour its first meal within seconds of hatching rukarumel field journal,NONE
whether or not you will bow to me is not open to debate the question is will i ever let you rise fridius telemin master,Light
angels my feelings remain unchanged liliana vess,Light
this may hurt a lot,NONE
the dwarves call their quicksilver techniques improvisational weaponsmithing,Light
it startles me how alive one feels on the edge of death barrin master wizard,Light
reluctant to meet face to face the leaders of the ten guilds prefer to do official business through a gobetween immune to bribes and threats,Light
well how could i know theyd explode gregel township militia,NONE
