words,tagname
some adopted the tactics of the leonin to combat the ferocity of the minotaurs,Light
the essence of a lawful society is swift deterrence,Light
not every church is a place of faith,Light
tread upon these flower beds at your own peril emmara,NONE
textiles at the inventors fair feature threads from every corner of kaladesh,NONE
aetherborn who are unwilling to accept the decomposition of their bodies invent ways to preserve and augment themselves,Light
no shadow remains for you to hide in caparocti sunborn,NONE
its hard to keep our own troops from fleeing when hes like this how can our foes possibly stand against him field marshal for the eastern paladin,Light
the true measure of all heroes is not what they achieve but who they inspire triumph of gerrard,Light
heres how ya win dont let the other guy hit back first jula goblin raider,NONE
secure in the embrace of wood they want no part of eladamris war,NONE
all we had left were their black and bloated bodies maeveen odonagh memoirs of a soldier,Light
nothing restrains a burning passion,NONE
hold on tight little one ill get you to safety,Light
words never uttered by mortals flowed incessantly from its many mouths,NONE
words never uttered by mortals flowed incessantly from its many mouths,NONE
which do you deserve the heft of a femur or the graceful sharpness of a forearm decisions decisions    gisa the mad,Light
forgotten under rocks and vines gruul symbols mark the sites of primitive rituals where shamans once chanted to the wild,Light
illusion is a crutch for those with no grounding in reality chomanno,Light
where herds have passed the dented ground is lined with piles of rust,Light
there is always a rabble to be roused,NONE
picking hammers is dangerous but its still safer than harvesting saw bushes,Light
the leonin of oreskos are quick to take offensenot because they are thinskinned but because they are always ready for a fight,Light
when mirrodins varied civilizations developed ways to fight the levelers memnarch upped the stakes,Light
recruits arent always volunteers,NONE
the auriok see the artificer as a conduit beckoning new creations into the world,Light
finding the way once is luck finding the way twice takes a good map,Light
the only way to get mercadians to fight on the front lines is to give them really long weapons gerrard,NONE
purraj sang slaughter and danced death,Light
she asks pointed questions of the dead who wait for athreos learning of life from those who are about to leave it,Light
predictable little man in all these years you taught me so much yet learned so little volrath to starke,Light
get it bunnies letters xx me neither bucky flavor text writer,Light
a small price to keep such pretty things safe,NONE
often greatly outnumbered in battle dwarves relied on catapults as one means of damaging a large army sarpadian empires vol iv,NONE
paulo vitor damo da rosa world champion xxvi,Light
they are trained from hatching to deliver aid where it is needed most,NONE
the hounds barks are a horrifying chorus of screams moans and whispers,Light
hes paid his price now you pay mine,Light
recruits arent always volunteers,Light
the izzet are blamed for every little disaster which is unfair because we only cause most of them mizzix of the izmagnus,Light
many sigils one purpose,Light
stand against the crash of the rivers rapids and you will know the power of the naiads,Light
a skullkeeper is the first to arrive after the palace archers strike down intruders probing their brains for choice bits of knowledge,NONE
with the new guildmasters innovations arresters can arrive on the scene moments before a crime is committed,Light
zombies have one speed shamble,NONE
flittering wheeling  darting in to strike and then  gone just as you blink dragonfly haiku poet unknown,Light
like a volcano it too can erupt without warning,NONE
the weatherlight can no longer planeshift but it can traverse dominaria with ease,Light
heart of fire blood of lava teeth of stone,Light
you were so eager to take and consume yet when asked to give you refuse,Light
we all hide a little madness behind our sophistication do we not,NONE
it turns the adversity of the moment into the knowledge of a lifetime,NONE
heida allowed herself a moment of satisfaction as she watched the beast fall then turned to seek another foe it would be a long long night,Light
if a boggart even dares breathe near one of my kin ill know and ill not be happy,NONE
the path offered by the academy is long and difficult but those who brave it arrive at wisdom beyond compare,NONE
fail to respect the forest and you will fertilize it,Light
doing something at the last minute isnt so bad when you can make that minute last,Light
it wont bring them back but it will bring me peace,Light
master the sky and you rule everything beneath it metathran saying,Light
no longer the village pariah no longer taunted and shamed sigrun was finally free,NONE
i am in my element the element of surprise mogai sultai scout,Light
we could no more abandon the forest than the stars could abandon the night sky,NONE
new insights yield new senses,Light
i fight for the suns the surface and everything in between,NONE
their stench was vile and strong enough but not nearly as powerful as their hunger,Light
their stench was vile and strong enough but not nearly as powerful as their hunger,Light
there is great wisdom in rushing headlong into combat    if youre prepared kenjek captain of the thousand swords,Light
finders keepers,NONE
crovax had witnessed selenia lead the predator to the weatherlight as the battle raged on deck he felt his strength melt in the heat of her betrayal,NONE
it is a grim duty to save the world from those created to protect it,NONE
forget that which was never known spellbomb inscription,NONE
with this throne unite your nation throne inscription,NONE
panic spread like wildfire as the demons of immersturm poured into bretagard slaughtering as they came,Light
this is why we dont go out in banewasp weather rannon vithian holdout,Light
graceful yes beautiful absolutely harmless definitely not fyndhorn elder,Light
the destruction of markov manor made the surviving members of the bloodline more dangerous,Light
the secret to our war paint is hot peppers and stinkbugs lots of stinkbugs skab goblin secretkeeper,NONE
the fall of the evening star never heralds a gentle dawn,Light
the path to ruin is forged in pain,Light
merfolk dont always know what theyre looking for but theyre certain once they find it,Light
ever onward ever skyward,Light
theres no stronger armor than the bravery of those beside you,Light
orim taught takarnst and the other choarrim healers a far less invasive method of healing,Light
the first law of yavimaya is that guests may kill only to survive as fires arent needed in the warm weather cutting trees for wood means death,Light
my people serve the dragon kolaghan but i give my blood for a greater lord,NONE