words,tagname
a shadow of life chasing a husk of glory,Void
a good explorer has to be as slippery as a gomazoa as tough as a scute bug and luckier than a tenfingered trapfinder arhana kazandu trapfinder,Void
why do you weep for the dead i rejoice for they have died for me fallen angel to serra,Void
a shadow of life chasing a husk of glory,Void
i see your future mantled in ash,Void
sympathy is for weaklings whoever survives wins benzir archdruid of temple might,Void
the imp unaware of its own odor paused to catch its breath    and promptly died,Void
many hands for many evils,Void
humans still feared wolves though no connection between them and the curse of lycanthropy had ever been proved,Void
the noble paladins draw strength from the courage of others,Void
their war forgotten the nations of bant stood united in the face of a common threat,Void
i might have overfed him gulistan simic biomancer,Void
though buried and muffled natures whisper still called to nissa,Void
your life serves a higher purpose now ensuring the continuation of my own,Void
the agents of sneakserious nonstop espionage and kidnapping,Void
it doesnt need to use its venomit just needs you to know it can,Void
your father has no horns your mother wears a bell you drink the milk of goats talruum taunts,Void
i strive for elegance and speed in my work jaya ballard task mage,Void
the beetles feed not on the flesh of corpses but on the metal grinding out the iron and steel to add to their own bulky shells,NONE
hush,NONE
they traverse the manastarved wastes in search of richer lands,NONE
even swamps need sustenance we will give it to them and in turn they will sustain us ezrith druid of the dark hours,Void
the refuges defenses allow new recruits to see lesser eldrazi up close steeling their stomachs for whats to come,NONE
danish island scandinavia,Void
its a dragoninfested lavascape of notorious peril make yourselves at home,Void
just think of me as the storm before the calm gerrard of the weatherlight,NONE
unlike many hunters these panthers have no need for camouflage theyre fast enough to catch any prey,Void
just as each added feather steadies the wing so does the flock grow stronger with each new member,Void
if i am to die in service there is no more worthy fight than this,Void
its not really stealing its more like extended borrowing,Void
action this creature is a bloodhound formed entirely of water,Void
hope kept the defenders aloft but only courage kept them in the fight,Void
no one knows when the tournament began all they know is that it will never end,NONE
well break their lines the rest of you follow,Void
titania rewards all who honor the forest by making them a living part of it,Void
the best way to keep a secret is to forget it lazav,Void
the truth will outshine all lies,NONE
whenever the llanowar elves gather the fruits of their forest they leave one plant of each type untouched considering that natures portion,Void
the warriors deal in poison and fangs we shamans remember why our ancestors crawled with their bellies to the earth,Void
the floor of the sea is paved with the shattered remnants of vessels that navigated its surface unwelcomed thassa god of the sea,Void
to reach my age you must know when to bend with the winds and when to stand tall,NONE
the keldons may have explosive tempers but i have explosives,Void
peace will come to innistrad but only after all abominations have been dealt with one by one,Void
the consulate rarely cracks the coded announcement of a night markets location before dawn and enforcers are taken care of if they wander too close,Void
this creature is inadequate send it to the splicers for innovation malcator executor of synthesis,NONE
the sea has many secrets but some are too big to be kept,Void
those who find death under the black suns shadow cannot escape its pull,Void
to a sabretooth all men are mice,Void
venser admired his handiwork and smiled his first prototype had joined with the hive mind all too well running with the brood and becoming a predator itself this one he thought would be accepted into the hive but still obey his commands,Void
when darkness closes in around us my blade will light our path,NONE
her eyes blaze with the strength of twenty shields every glance is a salvation,NONE
dance and bring forth the coil it is an umbilical to gaea herself fattening us with the earths rich bounty,NONE
in the hold of the heart of kiran chandra answered dovin baans sabotage with an explosive retort,Void
he makes his home on the tallest mountain in sejiri where the vista is as endless as his patience,NONE
what separates junk from treasure is imagination hanna weatherlight navigator,Void
infinitely powerless,Void
may they speed to their task for the skyknights alone cannot hold kjeldor safe arna kennerd skycaptain,NONE
magestudents drawn to the power of language choose silverquill the college of eloquence,NONE
and i will prove my devotion,Void
of course you should fight fire with fire you should fight everything with fire jaya ballard task mage,Void
proximity guarantees injury or death,Void
when raganorn unsealed the catacombs he found more than the dead and their treasures,NONE
many scholars believe that these creatures were the result of urzas first attempt at mechanical life perhaps created in his early days as an apprentice to tocasia,NONE
emrakul does not grant wishes desires simply align to her will,Void
full of beauty and grace with a predators instincts   although she wanders i have always thought mirri belongs in llanowar most of all rofellos llanowar emissary,NONE
soramaro speaks through me listen and i will tell the wisdom of the ancestors,NONE
the light of a felidars horns can give even an eldrazi pause zarra lullmage,Void
the spread of its hood eclipses all hope,NONE
once a vision of constancy in the sky the moon had long been hidden from view by the haze that chokes the heavens the very sight of it had become a sign that change was in the air,Void
it vents the chill of the grave,Void
they arent helping the forges send them to the surface furnace boss sector,NONE
its not the size of the rock its how badly you want to lift it,Void
call one call them all,Void
phyrexia strives to simulate natural life but it cant resist improving on the design,NONE
as elusive as the footprint of a djinn suqata expression,Void
what wears down my people most i think is not the danger but the endless screeching outside our camp merrik aidar benalish patrol,NONE
virtue cant survive without strength ardanna of the angelic council,NONE
only on the battlefield can we repay all the order has given us,NONE
just wait till i get my leviathan,Void
blades and bravery go hand in hand,NONE
i will carve my peoples vengeance on the face of phyrexia,Void
the ruins of the town were a notable upgrade from the wolves forest den,Void
its harvest time,Void
a vulshok weapon strikes with the fire of the forge that made it,NONE
hail from tolaria the ever changing dane,Void
the river heralds would wreck a thousand ships to keep intruders from finding the golden city,Void
by thorn and by stone we will fight to see the day when beauty returns to this world,Void
the second stage of the illness high fever and severe infectiousness phyrexian progress notes,NONE
the first of the thousand deaths,Void
goblins motivational techniques are crude but effective,Void
one light one blade one purpose vow of the serra paladins,Void
vampires are now masters of their own fates commanders of their own legions,Void
its easy to believe youre a god when youre twice as powerful as everyone else,Void
only one man survived barely sane he got out two words before collapsing shadows shadows,Void
one of the oriqs most powerful tools is the mage hunter a vile monstrosity created to seek out and snuff out the arcane,NONE
to survive you must seize every opportunity daghatar the adamant,NONE
where the nefashu pass blood rolls like a silk carpet,NONE
with innovative stabilizing techniques suja pavani brings this piece of the sky itself to the inventors fair,NONE
not for the bumblefooted nor wobblestomached kreq of sunder bay,Void
after seeing his lifes work drip away the mage decided it was a good time to go crazy,NONE
tawnos won fame as urzas greatest assistant after he created these warriors urza ended his apprenticeship promoting him directly to the rank of master,NONE
a lifetime of discipline forsaken in a moment of rage,NONE
when the moon rises and the bloodlust takes hold nothing matters but the kill,Void
i implore you not to forget the horrors of the past you would have us start the brothers war anew sorine relicbane soldevi heretic,NONE
hate gets you only so far a pointy stick can close the rest of the distance,NONE
knowledge is a feast for the mind savor every swallow,Void
native to wide prairies and scrublands falcons occasionally roost in dragon skeletons,Void
as the hedrons began to coalesce into colossal eldrazi superstructures the griffins were forced to seek new territory lest their aeries be crushed between the massive stone monoliths,Void
while you were wasting time with abstract equations i mastered ancient oggyar fire magic your move,Void
the noble steeds of the elven gods can sometimes be persuaded to allow mere mortals on their backs,NONE
faugh snorted tahngarth why would it make a meal of something like you squee looked relieved no he continued youd make a much better toothpick,NONE
every device in the rig is evidence of thran enlightenment all mana was the same to them whether from rock or water growth or decay can you imagine such unity of vision urza journal,Void
formerly oppressed by the polis of meletis leonin occasionally mistake their old enemies for game,Void
pockets full of gold lungs full of brine,NONE
destiny is a flickering path among tangled possibilities,Void
nature grows solutions to its problems,NONE
the clouds broke and the suns rays burst forth each foul beast in its turn faltered and was gone,Void
the defenses of the abzan extend well beyond the walls of their fortresses,Void
i wouldnt want you to hurt yourself bruenna neurok leader,Void
its root system spans the entire floor of the jungle making eradication impossible,Void
from the roil emerged a ravenous primordial being of pure mana,Void
some samurai fell so far out of grace that only dogs would keep them company,Void
those that fall short of perfection can still contribute to the great work keskit the flesh sculptor,NONE
an eye for detail a mind for numbers a soul of clockwork,NONE
i have calculated that a dragon in flight in a single strafing run can cover an area of thaedus the clever last words,Void
they are bred to suffer and born to die much like humans gix yawgmoth praetor,Void
asia vintage champion,Void
yes boros tactics are unparalleled but when your comrades are dying around you inner strength must carry the day gideon jura to aurelia,Void
the rising of the first full moon eliminated any doubt as to the horrible truth lurking within,Void
the sound of the trumpets lights a fire in the hearts of the bold and snuffs the courage of the cowardly,NONE
unpredictable as a storm and destructive as a tidal wave,Void
what the golgari cant claim through patient undercity expansion they seize in brazen topside sorties,Void
the forests constant struggle is to keep the spreading flowstone at bay,NONE
you were so eager to take and consume yet when asked to give you refuse,NONE
aspiring wizards must demonstrate basic levels of willpower and mental discipline to even be considered for an apprenticeship,Void
the more important the message the larger the messenger,Void
voska feared the artifact had come too easily,NONE
naturally inquisitive and adaptable goblins can turn their small stature to their advantage as rogues,Void
my family was saved thanks to a single boros soldier its why i joined the legion i will be the protector now,Void
good dogs stay by your side until the end great dogs leave to bring back aid,Void
i got your milk right here,NONE
to be counted among the warriors of setessas leina tower you must not fear death only failure,Void
vintage championship winner,Void
serves you right for rushing ahead kaliea sea gate trapfinder,Void
doors walls skulls    it matters not all barriers will be broken,NONE
raths new evincar eliminated the brutish moggs and took a new slave race one more reminiscent of her own feline grace,Void
the skyhunters were born when the first leonin gazed at the heavens and wished to hunt the birds overhead,Void
the most popular pit fighters are brought back for encore performances,Void
we may have lost faith in our gods but we are far from losing faith in ourselves munda ambush leader,NONE
unlike previous conflicts the war between urza and mishra made dominaria itself a casualty of war,NONE
lavamancers make simple requests obey or die,Void
the soldier moved with fluid poise his awareness extending far beyond five senses,NONE
lets lure the drakes to the webs over the samok stand keep the spiders content aurelia,Void
few of raths rivers follow a steady course so many new channels are carved for them,Void
theyre the chairmen of the bored,Void
my sorrow to dream of simple times and wake in mine     ola dariol regrets,Void
with a sadness and a sense of hope senka left the colony of her birth and with her attendants set out to serve as broodmistress founder of a new colony,Void
its bad enough to be torn to pieces its worse by far to be torn from the world itself,Void
one who is marked by a demon in life is sure to be remembered as one in death,NONE
hmmmmidnight snack,Void
let the land dwellers know the coast is no longer the border between our realms a new age of empire has begun,NONE
the people wiped the sand from their eyes and cursedand left the barren land to the hyenas and vipers afari tales,Void
no signs of any suspicious activity yet,NONE
twilight falls we rise necropolis inscription,Void
he listens to the sounds of battle filtering down from above waiting for silence waiting for his time to claim the streets,Void
the fiercest loyalties are earned in battle gideon jura,Void
the demon griselbrand dared to stand against avacyn earning him the loathing of thousands and the admiration of a few,Void
the ilkor no longer roam the open plains but they are still hunters,Void
most students could barely endure dean embroses scrutiny for a semester or two killian lived with it his entire life,Void
when churchyards yawn and hell itself breathes out contagion to this world william shakespeare hamlet,Void
its web is an excellent source of found copper for the daring or the stupid,Void
kozileks brood infiltrates and deceives the spawn of ulamog mindlessly consume,NONE
the pen is mightier than the crown,NONE
now its your turn to hide vraska,Void
the mushrooms growing in the wolves fur possess curative properties incredible enough to tempt many alchemists into risking their lives to track one down,Void
i hear halinas got a pony that can count to sixand likes to eat meat chandler,Void
after the destruction of the helvault fearful mobs soon became fearless battalions,Void
this is a tale to make all kaldheim tremble,Void
the beauty of it is they never see it coming ever razzix sparkmage,NONE
rootlike fibers travel far from mirrodins metallic forests emerging from the crust to drink in the manainfused sunlight,Void
the sea holds all that you need you simply must know how to ask for it,NONE
the best leaders are made by their followers,NONE
half a brain rules the mindless,Void
if your blood doesnt run hot i will make it run in the sands maraxus of keld,NONE
one beginning many paths vannifar,Void
tritons borrow the camouflage of their oceanic prey to become predators on land,NONE
it has more teeth than fit in its mouth,Void
just the place for a picnic murat death speaker,NONE
festivals just ahead youre almost there,Void
battle tempers soldiers as fire tempers steel,Void
sea gate may have fallen but we still stand we still fight gideon jura,Void
at the battle of changan ma chao defeated the two generals cao cao sent to guard the pass but was forced to flee when cao caos trickery turned his own ally against him,Void
grelden knelt and felt the cool dry hand of the priest on his brow hours later when his wits returned he was covered in his enemies blood on the field of victory,Void
you might want to step back jaya ballard task mage,Void
once nissa selected worthy fighters to defend the joraga now she gathers forces to defend all of zendikar,Void
a solution in search of a problem,NONE
the feline eternal felt lilianas command looked at her disdainfully flicked its paw and scampered away across the rooftops,Void
changelings cannot resist the draw of a new shape even if doing so would be in their best interests,Void
dosans monks deep in spiritual thought could walk through the thickest of forests without leaving a mark even the leaves beneath their feet unaffected by their passing,Void
and i will bring the fury of the wild back to my village,Void
a focal point for time rifts foriys contends simultaneously with foes both new and old,Void
this city will perish and the gruul will cheer as the boargod crushes the last bricks into dust nikya of the old ways,Void
secrets what secrets,Void
by appearing in places miles apart at the same time zuo ci exhibited the mystics ability to shrink the land,Void
the greatest challenge isnt the stifling heat but the crushing weight of those who failed before,Void
they feed on the living to stay undead,Void
there is always another way,NONE
were now to dispense aid to any mirran we see battling anything    strange regents orders ranya skyhunter captain,Void
long after the magic wore off the mice still dreamed of glorious galloping tales of the fae,Void
the paladins would be wise not to forget about the pearl trident the merfolk warriors have turned the tide of more than one human war  and i have no doubt they shall do so again onean scholar,NONE
if you threaten its territory it produces spores actually no matter what you do it produces spores hadi kasten calla dale naturalist,Void
never mistake deception for cleverness,Void
it loomed up over the horizon silent and dark as a grave,Void
after his hands had crumbled away leaving only wickedly sharp points he decided his only purpose was war,Void
buyer beware,Void
a weapon best suited for those with good aim and steady hands,Void
though gideon arrived at sea gate too late to prevent the massacre he still had enough time to lead its survivors to relative safety,Void
we raised eelhawks to control the squidflies then waspcrabs to prey on the eelhawks now what do we do with all these waspcrabs gulistan simic biomancer,Void
anarchy comes in many forms social individual gruul,NONE
who knows from whence the winter comes,Void
see the land itself raises an altar to the ascendancy of nature mayael the anima,Void
choices are rarely as simple as they seem,NONE
arent you going to offer me a drink,Void
old home never forgotten new home ours forever,NONE
no god on theros ever truly dies as long as there are those who still have faith in them,Void
if i am to die let it be a heros death,Void
he tried to live far from those he could hurt,Void
inner strength is never seen until it makes all the difference,NONE
the winged helms of the guard are put on for pageantsbut taken off for war,NONE
relative of yours ertai teased mirri simply sneered,NONE
may you drink until you drown but never be sated odila witch of morkrut,Void
oketras closest viziers are known as her chosen though others may have a better claim to that moniker,NONE
your signet is no symbol of power it marks only your need for numbers to aid you what do you do guildrat now that you face my blade alone,NONE
with innovative stabilizing techniques suja pavani brings this piece of the sky itself to the inventors fair,NONE
i am the storm,NONE
pathetic let me show you how its done,NONE
ogre shamans must be bright enough to learn their invocations and dim enough to use them,NONE
do not call the balduvians barbaric their magic is as potent as it is primal zur the enchanter,NONE
saffiyah clapped her hands and twenty flying men appeared at her side each well trained in the art of combat,Void
each form she takes is an exploration of the senses,Void
as much as i hate water i do love fish     mirri of the weatherlight,Void
she watches the chaos created by the roil seeking strength in the patterns of anarchy,Void
progress leads to inspiration,Void
i cannot read these runes yet somehow they seem like a warning have we passed unknowingly into a new realm ekken omenseeker navigator,NONE
legend speaks of the sun spear the mighty weapon that can strike any point in theros even the depths of the underworld,NONE
the welcoming appearance of the arrow bamboo forest masks its deathly hostility,Void
furious and unable to separate the bitter rivals consoled themselves by splitting everything else they saw in half,Void
beasts kill for their very survival if you would have their strength you must know their desperation konnos sylvok sage,Void
the heavens augur weal    for me woe for you,Void
rigorous faith and belief are rewarded on occasion and richly so,Void
we fought so long to hide this place let us be first to learn its wonders,Void
each syllable chills your veins each word rattles your mind cabal patriarch,Void
faeries talk all in riddles and tricky bits cept the nobles now theres some straight talkers joskun anhavva constable,Void
they soar and the mystics follow,Void
that didnt happen naturally said multani raths overlay is interfering with the ther itself,Void
the best cure for a big ego is a little failure,Void
it can chop down a redwood in a single stroke your sternum isnt going to fare any better,Void
fear the knight leaping from the water into the air weapon ready,NONE
valiant icatia was the last of the sarpadian empires to fall its faithful soldiers defended their cities to the very end sarpadian empires vol vi,NONE
why do you weep for the dead i rejoice for they have died for me fallen angel to serra,NONE
as the elves learned the hymns of angels the knights learned the roars of titans,NONE
we each have our own strengths radiant serra said with a sly smile if all of my people were like this one who would carry your scrolls,Void
the sacred might of thune thunders in my soul,Void
you know that secret the one that wakes you up at night in a cold sweat the one you think no one else in the world knows well guess what,Void
a spiteful force exists on ravnica that binds these ghosts to the land of the living but forbids them to touch it,NONE
although the elves of havenwood lived in isolated villages their swift communications allowed them to act as a single community,Void
he does not tolerate intruders,NONE
in the tangle bad is often followed by worse,Void
as peace returned to thraben some cathars made the mistake of letting down their guard,NONE
facets of life reflections of the soul,Void
sympathy is for weaklings whoever survives wins benzir archdruid of temple might,Void
until all have found their place i will keep watch,NONE
passions cant be shackled by laws or mastered with logic the choice is freedom or death volume iv the book of fire,NONE
it is better to take what does not belong to you than to let it lie around neglected mark twain more maxims of mark,Void
few among the living understand just how much of their world is shaped by the ruins of the dead,NONE
and now im coming for you,Void
kothophed bestowed upon liliana eternal youth carved into her skin as intricate tattoos,NONE
villagers cloaked the town in magical silence but their ears still bled,Void
in llanowar we tend the forests boughs and branches in yavimaya we are a part of them rofellos of llanowar,Void
in every other mind the battle was lost general takeno alone was not touched by despair drawing his blade he was attack and rallying cry in one battle of akagi river a survivors tale,Void
if im going im taking you with me,Void
some merfolk choose to rest their fins in the water i believe wisdom exists not only where we were born but where we were told not to go,NONE
with the hekma destroyed the wandering dead that sought entrance to naktamun had free rein to lay waste to the city,NONE
their thoughts flow through my mind and i am healed fyndhorn elder,NONE
no emergency is so dire that it cannot be dealt with elegantly olivia voldaren,Void
a cinders axe bears no marks from parrying a foes blade,NONE
i reeled from the blow and then suddenly i knew exactly what to do within moments victory was mine gustha ebbasdotter kjeldoran royal mage,Void
flash like daybreak to the fray motto of the knights of dawn,Void
the haazda shield is broad protecting both the free and the guilded,Void
a single ambition unleashes a legion of horrors,Void
though innistrad is not cleansed of evil we finally have cause to rejoice,Void
the trick is to ask when no ones listening alexi zephyr mage,Void
the river split into many channels as it flowed to the halimar sea few travelers could follow the same one twice,Void
like many izzet creations weirds are based on wild contradictions yet somehow manage to work,Void
no one is as dedicated to perfection as a stitcher working on their latest masterpiece,Void
with great power comes great risk of getting yourself killed,Void
fellowship the fourth myth of reality as the tides of war shift so do loyalties,Void
this creature is inadequate send it to the splicers for innovation malcator executor of synthesis,NONE
nature grows solutions to her problems,Void
never leave the future to fate,Void
every sword drawn to defend is an angelic blade guided to justice by an angelic hand auriok proverb,NONE
