words,tagname
yes im alone no im not worried,Void
they brandish their latest theories as warriors would wield weapons,Void
vampires know blood and the systems that carry it and they know exactly where to strike to set it free,Void
at the waterfall the border between the humanoid and the spirit worlds was weakest the kami moved across it with ease and at will,Void
the nightmare arises from its lair in the swamps as the poisoned land spreads so does the nightmares rage and terrifying strength,Void
may angels fly at your back may your blade cleave the darkness war blessing of serra,Void
the ultimate treasure is one that guards itself,Void
what separates us from mere beasts is the capacity for selfimprovement,Void
in the swirling mists you could walk right up to one and not know until its teeth are in your throat,Void
if you cannot turn your enemys strength to weakness then make that strength your own gresha warrior sage,Void
proud am i  strong am i  courageous in defending my children  and fierce in punishing what stands in my way so the elephant speaks zhalfirin song,Void
archons dispense justice according to an ancient and flawed premise nissa revane,Void
everyone should owe you something geth lord of the vault,Void
moon market merchants sell a bottled scent to cutpurses and other criminals those doused in the liquid become griffin bait,Void
each small blaze she sets jogs her memory letting her piece together the mystery of her own fiery end,Void
fight mischief with mischief,Void
the sidar who raised me had a saying the first step into death is the hardest gerrard of the weatherlight,Void
anyone can admire creation only a barbarian sees the beauty in demolition kamahl pit fighter,Void
come on you twisted things dont you want to get acquainted,Void
in the soil of leadership sprout the seeds of immortality kaysa elder druid of the juniper,Void
the voices of the dead ring in the heart long after they have faded from the ears,Void
any creature on a druids shoulder is his family any land under his feet his home,Void
theres no heron in the moon its a shrew a fivelegged shrew with a voice like whispering thunder,Void
i decide what stands in my way,Void
dromoka has regard for the humans who serve under her in return for her protection they obey with steadfast loyalty acting as weapons for her and her scalelords against the other clans,Void
words to bless the eye that reads them telling of a future beyond the reach of fear,Void
hang on im just tidying up chandra nalaar,Void
our archers made sport of it as it fumbled its way up the slag ridge as it collapsed we thought ourselves safe but the foul thing carried more than necrogen adaran tangle hunter,Void
hold on to your ideals theyll be tested more than your armor or the edge of your blade tajic,Void
i bring a dawn that no night can follow,Void
they are bred to suffer and born to die much like humans gix yawgmoth praetor,Void
what you call decay i call ripening youll gain no sustenance from this harvest kaervek,Void
the tall reedy grass of the daru plains rustles loudly in the winds a perfect cover for any ambush,Void
i welcome it the pasture is cleared of weeds and the wolves are frozen solid lumi goatherd,Void
obey,Void
once you create perfection what else is there to make arcum dagsson soldevi machinist,Void
are you sure this is going to work asked will no said rowan but if it does its going to be spectacular,NONE
its not eager to lose the other eye,Void
every creature on mirrodin is a lightning rod,Void
ill fight two at once and then lick their guts from my blades,Void
let go your grudges or risk wandering the bogs forever in a murderous rage hildin priest of avacyn,Void
it does not wear a crown or sit on a throne of gold but those who have witnessed its power hail it nonetheless,Void
an eye for detail a mind for numbers a soul of clockwork,Void
the agents of sneaksinister nerds eliminating all knowledge,NONE
our love is like the river in the summer season of long rains  for a little while it spilled its banks flooding the crops in the fields love song of night and day,Void
their language may be a cacophonous agglomeration of chittering snorts and mad barking but the message they send is all too clear,Void
we are a clachan of smiths the forge is as comfortable to us as a small fire during a cool winters evening,NONE
after the battle of pharagax bridge the champion spent many months among the leonin of oreskos she found that they were quick to take offense not because they were thinskinned but because they were always eager for a fight the theriad,Void
what warrior worth the name fears to leave a trail if my enemies seek me let them follow the ashes in my wake,NONE
i wish i could rewrite my every deed and kill you with my first breath instead of my last,Void
headlong is the only way to pass through the gate to the afterlife,Void
each of viviens arrows is an invocation of a species,Void
artifact construction requires immense resources,NONE
tis better to give than to receive,NONE
the elves learned long ago that anything left here slowly vanishes now it is a sacred site where the dead are laid to rest and where unnatural magic is erased forever,Void
the essence of flame to stoke the spirit,NONE
fear is its habitat sanity its prey,Void
zendikar has suffered enough it is time at last for my home to know peace,NONE
when a phoenix nests in a volcano we rejoice for it means a hundred years of war golmak keldon warlord,NONE
its better to carry a little extra weight than to find yourself halfway down a baloths throat with no knife doral bala ged guide,Void
everything the kami had done they did with more force gentle breezes became typhoons rolling rivers turned to crushing rapids and gentle growth became overnight masses of thorns and vines,NONE
i gladly offer my weapon and my life to the glory of my sovereign,Void
originally considered the work of urza this tablet was created by forgers seeking to imitate urzas masterpieces,Void
theyre ugly and theyre in my way tahngarth,Void
some shamanic sects advocate the different seasons each working to preserve natures cycles,Void
the scullers beneath esper keep strixes as trained pets and set them loose when a fare refuses to pay,Void
anywhere else they would be hunted for their skins but in wirewood they are safe,Void
the face of light will shine upon them and they will know war no more song of all canto,NONE
tools and artisans can be destroyed but the act of creation is inviolate elspeth tirel,NONE
infinitely powerless,Void
rise like the sun stand like the mountain charge like the lion die as a hero general takeno,Void
there are some shadows that even the dimir fear,NONE
get up slugabeds weve got company and theyre not dressed for a party,Void
after gideon cleansed the ninth district none of the ganglords challenged the boros,Void
out of my way,Void
the miraris magic transformed the krosan forestand its inhabitants,NONE
channel your vitality through me,Void
zendikar is a brutal taskmaster but sometimes it offers unexpected solace,Void
a boon to those who cannot see in the dark a bane to those who live in it,Void
when the levelers come again we shall be ready for them,NONE
every day i fight for my life and win every night i fight to remember my name and lose,Void
he realized a bit late that he was supposed to plant the magic beans,NONE
ereboss minions hunt the returned and warn those who consider the same folly,NONE
although their methods were often brutal farrels followers believed in the preservation of justice and virtue,NONE
changes far greater than the turning of the leaves await us at seasons end colfenor the last yew,Void
i see more than other because i know where to look saprazzan vizier,NONE
it has flown the sky for eons without ever touching ground,Void
in its lair lies a carpet of bones,Void
graarg,Void
what are they complaining about its not like axiomatic leyline paratrigonometrics is hard,NONE
enter those who are starving and sick you are welcome among the swarm when the rest of ravnica rejects you,Void
the golgari raise the bodies of their dead to serve we raise the spirits of our dead to lead,NONE
four parts molten bronze yes  one part frozen mercury yes yes  but then what,Void
good dogs stay by your side until the end great dogs leave to bring back aid,Void
death everyone does death let me show you something actually impressive,Void
gaea forged her soldiers into selfwielding weapons that struck down all impurities,NONE
feed it steel feed it gold feed it bone in the belly of the furnace the flames know no difference,NONE
that didnt happen naturally said multani raths overlay is interfering with the ther itself,Void
wei won the battle of hefei when zhang liao defeated sun quan and then foiled a wu scheme to incite rebellion,Void
when nightstalkers sing nothing in creation sleeps,Void
let the wild in channel its strength freyalise,Void
callaphe gazed on the coastline certain her destiny called her here where the mistshrouded rocks sang promising glories undreamed of the callapheia,NONE
wonders hide where the trees grow thickest mul daya proverb,Void
doyo suspected the boggarts of brewing a plot against his crop so he scythed away his grain to clear the sightlines,Void
her beauty was the beauty of the sun at midday deadly to those who underestimated her strength azeworai kenechis dream,NONE
the smell of roasted flesh hung over the valley for hours onean sergeant,NONE
try to pretend like you understand whats important,Void
the settlements defenders were glad to have such a massive ferocious creature join the fightbut less glad to see it flatten their homes along the way,Void
get in touch with your inner monster,Void
have you ever killed insects nibbling at your crops i think thats what the eldrazi believe theyre doing to us sheyda ondu gamekeeper,Void
dagsson saw the steam as lifegivinguntil his followers felt its scalding touch sorine relicbane soldevi heretic,Void
selvalas arrival never goes unnoticed,NONE
none can own the lands bounty the gods made this world for all to share its riches and im not just saying that because you caught me stealing your fruit,Void
subservience to greater power is the only law in the pit,Void
dont let him lead the soldiers but by all means let him lead the way,Void
atarkas presence thaws the glaciers of qal sisma forcing its elementals to migrate or adapt,NONE
amateurish nearsighted a waste of my time and everyone elses indra nullmage of vectis,Void
hush,Void
it came to rest upon the angels arm and then the weight of their gazes fell upon me aeronauts journal,Void
turns out coffee is the weird aunt of invention,Void
i barely escaped with my life at that number they could take on emrakul herself samila murasa expeditionary house,NONE
from the fertile muck of zagoth everythinganimal botanical and crystallinegrows with rugged beauty,Void
well be easy targets if we remain on the ground lets take the fight to them,Void
idle chatter beckons many an attentive ear,Void
necromancers are judged by the most powerful undead theyve ever created there are those who have animated just a single being yet are considered the pinnacle of their dark craft,Void
bonder and bonded move in unison intuiting each others next move,Void
some delicacies are not to be savored save by the callous baron sengir,Void
looks bad i dont know if hell make it through the night cabal cleric,Void
the bravest warriors take the shortest path to victory whatever that path may be sakta atarka hunter,NONE
magestudents obsessed with the secrets of the past choose lorehold the college of archaeomancy,Void
initiates live and train with their crop the unit that begins the trials together,Void
but then    oh but    which means    which would lead to    exactly,Void
what are the orders of a king or the demands of a creed next to such melodies,Void
the most harmonious designs are based on relationships found in nature venand kapur the gearherder,Void
it slips silently through the still waters of the labyrinth of memories to feed,NONE
it can kill you with three arms tied behind its back,Void
the first searchlights were given as gifts symbols of cooperation to the emissaries present at the signing of the guildpact,NONE
as the climate worsened some thelonites turned to fertilizing with fresh blood in an attempt to keep havenwood alive and growing sarpadian empires vol iii,Void
there are only two rules of tactics never be without a plan and never rely on it,Void
hope is born within,Void
i know just the person for that job,Void
part prison part home,Void
blood calls to blood,Void
as the glass shattered forgotten realities and dead memories came flooding back,Void
see evil hear evil speak evil,Void
every once in a while when they arent getting incinerated in lava crushed under rock slides or devoured by dragons goblins experience moments of unmitigated glory in battle,Void
goblins in the first wave of a fire raid always bemoan the aim of everyone else,Void
his fists fume with the decay of death each strike a plague on the hearts of his enemies,NONE
i see more than others do because i know where to look saprazzan vizier,NONE
the strongest of the pride are measured not by the steel in their hands but by the steel in their souls,NONE
as powerful and malleable as the molten rock it calls home,NONE
they are drawn by the brilliant blue glint of the mineral lazotep from the mines below,Void
basic senses like sight and taste are reserved for those in power,Void
i am confident that all our enterprises can benefit from this little revolution,Void
from here let the world be reborn,Void
mercadias masks can no longer hide the truth our day has come at last,Void
one day every pillar will be a tree and every hall a glade trostani,Void
i have been brought to this place and i cannot leave i may be free of the amber but i am still in prison,Void
and furthermore,NONE
hurkyls research at the college of latnam wasnt enough to stop the two brothers but for centuries thereafter her spellcraft taught artificers restraint,NONE
he spent the final moments of his existence tumbling down the length of the serpents jaws driven mad by the magnitude of the cosmos,Void
reynald wished for an army to sweep away his enemies the fae king smiled beyond the great henge,NONE
the seekers of carmot searched across the unknown lands for the mystical red stone that could reforge esper in ethereal perfection,Void
as long as rushwood glows no life is ever truly lost takarnst choarrim healer,Void
prayers for rain are answered with the thunder of hooves,Void
are you tired you look tired,NONE
the husk splits like a madmans smile and mystery steps forth snowfur kitsune poet,NONE
standing near a volcano barbarian expression meaning asking for it,Void
by the time the spider comes to slurp up its dinner its victims have been partially dissolved by acidic silk,Void
the best construction makes the most satisfying destruction domri rade,NONE
as narset struggled to meditate tiny dragonlings spiraled around her conjuring thoughts of ancient clans,NONE
who says werewolves are the only ones who can hunt as a pack kolman elder of gatstaf,Void
though mishra was impressed by the staves ashnod had created for zegons defense he understood they only hinted at her full potential,Void
reflect upon your evils lest they reflect upon you inquisitor laerin,Void
the bolt struck with a flash and there was a terrible sound as of glass shattering but the creature was unharmed,Void
we attacked with arrows dipped in poison the slivers that did not die began to change hastric thunian scout,Void
a trolls greatest weapon is its ability to emerge unexpectedly from the landscape,Void
the path is stable its the gusts all around it that are a bit whooshoopsbye kreq of sunder bay,NONE
it left behind an echoing emptiness more horrible than the grave,NONE
soul and bones kithkin are woven into their clans they fight fiercely and without selfinterest,Void
for a moment objects of pure mana glimmered in the wonderstruck boggarts hands in the next moment they were in his mouth as he chewed contentedly,Void
some of my kin dance for themselves without greater purpose nylea gives me purpose and with it strength,Void
with every end a new beginning,Void
looks like weve got company,Void
watch over my father tell him im safe but i wont come home until i find out how to bring him back to his senses and kamigawa is again at peace michiko konda last letter to general takeno,Void
the sooner you see the whites of their eyes the sooner youll spill the red of their blood,Void
the eastern paladin doesnt attack at night for the tactical advantage he does it for the sheer joy of fighting beneath the moon,Void
before we can destroy our enemies we must find them we must peer into every wretched hovel and every teeming market baral chief of compliance,Void
gremlins can change from pest to problem to plague in the span of a moment,Void
protection is woven into every vine and branch,Void
theres nothing i wouldnt give to achieve victory can you say the same tsabo tavoc to gerrard,Void
the kor forsake roots for the winding of the path forsake voices for the silence of the mind forsake all else for the poverty of isolation,Void
otarias last defense against the wave of chaos threatening to engulf it,Void
everything is in place nothing can happen that isnt part of my plan urza,Void
we are bearers of the ancient light keepers of suncrowned heliods blessings fight and the light will protect you,NONE
the sigil holds different meanings depending on its form and presentation while some wear it as a sign of status others wear it as a sign of debt,Void
if the mardu were more in tune with their beasts they would not scare so easily jilaya temur whisperer,NONE
great wall of china,Void
those wound tightest are first to unravel,Void
to find jadzi one need only wander,Void
with this crown assert your authority crown inscription,Void
future past and present become one in the blink of an eye,NONE
a giant statue of a dwarf is still a giant statue,NONE
nothing in nature goes to waste not even the rotting corpse of a goodfornothing bloodsucking vampire halana of ulvenwald,NONE
one whiff of the sweet pungent scent leads to euphoriaor to an early grave,Void
big distractions mean tiny nuisances can slip by unnoticed,Void
for hydras most problems can be solved with the addition of a few extra heads,Void
why limit yourself to mortal law when you can outlive those who enforce it czaric orzhov prelate,NONE
ive seen my master do this a hundred times how hard can it be,Void
merfolk tell their young of dandn humans of rag man dal tell tales of the dauthi and they are far worse,NONE
atarka conquered qadat the fire rim long ago winning over its efreet with a promise to spread the glory of fire to all the world,Void
they ride our trails as if they were designed to said the guard they were replied gerrard,Void
flog was out of his leaguethis game wasnt up his alley but the team couldnt spare him if he split,Void
xenagos has fallen and the world grows dark without him what can ever fill that darkness but our rage guruthes disciple of xenagos,Void
as their villages fell to werewolves fleeing refugees discovered they too had remarkable survival instincts,Void
this armor transcends the limitations of mere flesh and bone,NONE
life is fleeting and so is death only the oath is eternal,Void
a wolf without a pack is either a survivor or a brute,NONE
as the wu chief commander lu meng conquered shuheld jingzhou in  by disguising soldiers as merchants on boats filled with hiding troops,Void
i will reach infinity,Void
he blends seamlessly into the forest waiting silently for his prey,Void
her poppets bring joy to the truly depraved,NONE
wracked with rot it wrecks and ruins,Void
they wont see your shadow or hear your breath but they will feel your blade,Void
only nature wreaks such lovely havoc,NONE
a true shortcut isnt a way other people dont know its a way other people cant go,NONE
death lizard approaching capn brint doobin last words,NONE
fire is the universal language jhoira master artificer,Void
as i desire so it shall be nicol bolas,NONE
stop smell the roses eat the peoples,NONE
rain from this storm leaves you pinned to the ground like an insect,Void
froggy fighter at the gate draw your sword and meet your fate traditional childrens rhyme,NONE
i was made for this,Void
its colors entrance aggressors directing their violence,Void
all are welcome in the angels light,NONE
the demon had flown past the reach of ereboss whip but not the point of the sun gods spear,Void
they evolved the ability to concentrate their neural activity into a single pulse causing a disruptive but usually suicidal blast of psionic energy,Void
the essence of night to harden the soul,Void
a thousand phobias sopped from the city and wrung from rix maadi as one,Void
ghoulcallers trying to get in geists trying to get out     this duty is never dull,NONE
by all rights we should have perished in the kami war our perseverence is a tribute to mortal ingenuity and perhaps a few forgotten secrets found in the nick of time,Void
he gave the squirrels acorns they gave him vengeance,NONE
spells of madness often require a sacrifice of sanity,NONE
markov vampires cultivate an image of such decadent elegance that it can be easy to forget they can field a deadly fighting force,Void
the mongoose blew out its candle and was asleep in bed before the room went dark llanowar fable,NONE
the bonds of bushido will draw the dishonored back someday and i will be there waiting,Void
doyo suspected the boggarts of brewing a plot against his crop so he scythed away his grain to clear the sightlines,Void
spitting is the customary greeting between a creature and its magical impostor,Void
the venom cleanses the sickness from your body but it will not be pleasant and you may not survive pharikas blessings are fickle solon acolyte of pharika,NONE
they seek to break us let us show them our strength,NONE
they seek to break us let us show them our strength,NONE
there were no tombstones in orochi territory slain warriors were buried with a tree sapling so they would become a part of the forest after death,Void
designed by an ancient artificer the vials are strong enough to hold the very breath of a dragonuntil its needed,Void
wealth is a good thing compared to povertyyour food is better your robes are softer and your companions have bathed more recently kipkemboi kukemssa pirate,Void
dreams are just one more form of torment,Void
progress leads to inspiration,Void
the dawnhart survivors welcome recruits of all shapes and sizes,NONE
id just let the monkey have it if i were you you can make another but the same cant be said of your fingers turni greenwheel groundskeeper,Void
its dangerous indeed to be lost in someone elses thoughts,Void
as a child i was afraid of the dark now im afraid of the things i know are lurking in the dark waiting to bite my head off sneeflebrix expedition rogue,Void
the weight of death is heavy but not immovable,Void
only in dew from oona herself is there clarity enough to see a victims mind,Void
i felt unworthy even to dream of it hanna weatherlight navigator,Void
the goblin idea of music is to hit something with a stick,Void
following the suns cycle harvest season comes once a yearunless the druids bid the sun behave otherwise,Void
swirling eddies of ash hide crumbling cliffs treacherous drops and the slavering maws of unknown evils,NONE
you need a six all right everyone she needs a six,NONE
sun follows moon until she tires then carries her until shes strong  and runs ahead of him again love song of night and day,Void
a capable mage can tune its focus refracting mana through each disk in turn to cast any spell they desire,Void
he smiles with poisoned lips empress llawan,Void
you should see how small the map is,Void
he raged not just against vampires but against civilization itself,Void
their buzzing makes my bones hum from a mile away galenti treasure hunter,NONE
kithkin spellbottlers spend half their time preserving old memories and the other half punishing the new,Void
found families deserve a family crest too kinnan bonder prodigy,Void
cautious not to repeat vigs mistakes the simic fuse life essences using magic alone each result is called a krasis,NONE
and the ignorant shall fall to the squirrels chip,NONE
he takes out his fear of heights on anything above his head,NONE
he takes out his fear of heights on anything above his head,Void
picking locks is for beginners,NONE
his mind knows no fear registering only the burning impulse to destroy,Void
the tiger is always quick to fold,NONE
some relic hunters have given up exploring and gone to fight the eldrazi but i know our work is more important than ever the secrets we uncover could lead to the worlds salvation,Void
do not weep for the frail their time couldnt have been that far off nathrac plaguesower,Void
a bullet renders all sizes equal,Void
where hope has no champion evil rules all,NONE
they leave a trail of ash and sorrow,NONE
it strides through the whitecover mists in which even gargantuans can hide,Void
when youre dumber than a hammer every problem looks like one of those things you hit with a hammer,Void
some emeritus professors return from their wanderings periodically to share tales of the mystical wonders of arcavios,Void
it is terrible how one brief action can live forever in memory jolrael,Void
strike those abominations down let their names rot with their remains general kudro,Void
assume everything wants to kill you at the very least assume everything wants whats in your pack,Void
none of the other villagers dare venture into the wilds so she feeds the whole hamlet herself,Void
